
video_id,title,publishedAt,views,likes,comments
yZyX5zhh1FM,"May (Spa Version): Relaxing Music & Water Sounds for Spa, Sleep & Relaxation",2025-08-18T13:39:36Z,80792,1169,107
QslbVeIsbXQ,"Midnight Calm: Relaxing Music & Water Sounds for Spa, Yoga, Sleep and Relaxation",2025-07-29T19:07:02Z,103711,1527,164
HZz1j70nXZA,"1 Hour of Peaceful Instrumental Music 🌳 Birds, Piano & Guitar for Relaxation, Focus, Study or Work",2025-07-01T08:23:42Z,128608,1795,212
3pgIPEBn8nU,"All Will Be Well: Beautiful Relaxing Music & Soft Ocean Waves | Focus, Work, Study, Sleep",2025-06-12T09:04:44Z,131476,1964,205
N_9oqpCo4a0,Welcome to Soothing Relaxation 💚 Home of Beautiful Music by Peder B. Helland & Stunning Nature,2025-05-08T09:23:34Z,53504,1297,74
ucLw57gGLh0,Who else would love to relax around this campfire right now? 💚  #relaxingmusic #campfire,2025-03-28T10:03:16Z,88166,1781,98
O2lmYoQnkKk,Peaceful Spa Radio 💦 Water Sounds & Relaxing Music 24/7,2024-11-11T15:40:20Z,1246063,13433,0
Kf19H6bloGM,Breathing Technique for Stress Relief (5-5-5-5),2024-09-20T09:54:18Z,130482,1618,36
n7QiJEINlWQ,Relaxing Music & Breathing Technique for Stress Relief (5-5-5-5),2024-09-18T15:50:20Z,68090,945,26
QCiW7hsBdkk,Box Breathing Exercise to Reduce Stress & Anxiety (4-4-4-4) #breathing,2024-09-17T08:44:59Z,74595,1209,19
ttT8pDfLlbE,"Soft Touch: Light Rain, Thunder Sounds & Relaxing Piano Music | Background Music",2024-09-11T15:33:31Z,396680,3912,338
0k7WZybBuXk,Welcome to Soothing Relaxation 💚 The Shore of Dreams,2024-09-05T06:28:39Z,60011,1275,38
QJ6C1bTiRYA,The Shore of Dreams: Relaxing Sleep Music for Deep Meditation & Relaxation,2024-08-09T08:05:35Z,313096,3276,204
K0WVA_PEjEI,Beautiful Piano Music & Ocean Waves ❤️ Listen to the full playlist on our channel,2024-08-02T07:30:19Z,87347,1802,61
kBLbhgMCIzU,"Beautiful & Emotional Piano Music with Relaxing Ocean Waves | Relax, Sleep, Focus",2024-06-14T16:47:14Z,671695,6845,478
0WjEP29WF5o,"Relaxing Zen Music with Nature Sounds for Meditation, Spa, Sleep & Relaxation",2024-03-05T15:04:06Z,1037439,17404,282
5W2yfO7DAMA,When you miss summer ☀️,2024-02-29T10:39:58Z,85439,1002,30
pZVabEt_WuA,Peder B. Helland - The Promise (Improvisation) | Soothing Sessions,2024-02-05T12:37:39Z,203338,2294,234
i9Yjozs750c,Sleep & Meditation Radio 🧘‍♂️Deep Ambient Music with Fireplace 24/7,2024-02-03T14:47:11Z,460519,4565,0
n8x6FvjmuWI,Those rainy days with relaxing music... #asmr #cozy #relaxingmusic #rain,2024-01-26T12:58:15Z,56463,1214,54
7kwvrEMO9pY,Take a break from infinite scrolling and get back to your tasks 💚,2024-01-23T12:43:27Z,111644,1126,48
oKTj0bfn0oc,Moonlight: Ethereal Ambient Music for Deep Sleep by Peder B. Helland with Nature Slideshow,2024-01-16T09:41:24Z,561648,5202,377
gTA7xW191QE,"Need to wind down after a long day? My new album ""Wonder"" is out now 😁 #music #composer",2023-12-19T11:06:00Z,73738,1286,34
t_LWdZCMvGo,Take a break with relaxing piano music & birds chirping 😴 #relaxingmusic #relaxingpianomusic,2023-09-15T07:51:52Z,79892,2180,219
9ZLOtLj-cGE,Peder B. Helland - Tomorrow (Improvisation) | Soothing Sessions,2023-09-11T14:59:17Z,134438,2503,285
xdpar6_svL8,Feedback on a new music composition idea? #composer,2023-07-14T15:58:41Z,60522,1269,96
0rKFHwWeXuI,The Ancient Tale: Relaxing Duduk Music & The Beautiful Caucasus Mountains,2023-07-12T11:18:32Z,290467,3573,439
8UijvdWQtmU,Beautiful & Relaxing Duduk Music in the Caucasus Mountains,2023-07-11T16:36:56Z,115611,2314,74
SBacM0ENACA,Quiet Woods: Relaxing Flute Music with Rain Sounds for Deep Sleep & Meditation,2023-06-15T05:34:58Z,553529,5530,446
gYbsqQuxobY,Good night from Soothing Relaxation 😴💚,2023-06-05T22:09:53Z,175423,4120,87
xOpWPxjBTJM,Coming soon on Soothing Relaxation 💚,2023-05-26T14:45:47Z,62794,1598,25
rHwbgFP2eFA,Your friend is improvising on the piano while you work,2023-05-05T13:29:42Z,210883,2579,259
fLeWES05gaU,Relaxing Fantasy Music by Peder B. Helland,2023-02-11T23:00:18Z,62475,1558,33
CNuoPYp2UjM,Dreaming: Ambient Sleep Music & Golden Moonlight,2023-02-11T19:40:00Z,75733,1302,39
rZbjS9YcThs,Rainy Day: Relaxing Piano Music & Soft Rain Sounds,2023-02-10T06:05:00Z,197644,6633,69
iFkwFkNXOcc,Welcome to Soothing Relaxation 💚 Have a Soothing Day! 😊,2023-02-09T10:15:33Z,54186,993,31
BG3Wthi7pQc,Our Future: Beautiful Relaxing Music by Peder B. Helland,2023-02-07T20:00:04Z,54536,1222,28
QjqRG-4EjlI,Sleep With Relaxing Piano Music by Peder B. Helland,2023-02-03T17:05:00Z,58375,1606,27
cQtj3xH-Sy0,Beautiful Relaxing Piano Music with Rain Sounds 😴 You & Me,2023-02-02T18:19:56Z,1928848,37512,449
gqUrgYRHG8s,"Peder B. Helland Makes Beautiful Relaxing Music Live, part 1",2023-02-01T09:53:57Z,63822,1825,153
SeuEw4LVOEI,"Relaxing Music Challenge with Peder B. Helland, part 1 | Flute + Creek",2023-01-31T14:46:40Z,58799,733,34
EL6PXEIV9KQ,Who's Ready For New Relaxing Music On Soothing Relaxation? 👀,2023-01-30T18:02:51Z,49699,1190,38
vLt7djQoNoE,"Relaxing Piano Music by Peder B. Helland: ""A New Day"" ❤",2023-01-26T12:11:31Z,42394,1200,26
3dsbgEtoAKw,Who Loves The Combination of Birds & Relaxing Music? #relaxingmusic,2023-01-25T17:26:08Z,28439,934,37
ejlQQrZYdKc,Relaxing Music with Piano & Flute 🥰😴 #relaxingmusic #soothingrelaxation #music #sleep,2023-01-22T17:05:05Z,65004,2110,41
BirAwHctifo,Relaxing Piano Music + Ocean Waves =  💙,2023-01-16T11:08:29Z,69666,2501,52
Xde_bBKcGhM,One of Peder B. Helland's most popular piano tracks,2022-12-09T11:18:58Z,98851,4313,143
cMa0a21KgH4,Merry Christmas from Soothing Relaxation! 🎅❤,2022-11-23T14:17:56Z,253644,9070,104
